Sets,Count,Genes
,60,Gene3; Gene4; Gene5; Gene6; Gene7; Gene11; Gene12; Gene13; Gene14; Gene15; Gene18; Gene19; Gene20; Gene22; Gene23; Gene24; Gene26; Gene29; Gene30; Gene31; Gene33; Gene36; Gene38; Gene41; Gene42; Gene43; Gene45; Gene46; Gene47; Gene48; Gene49; Gene50; Gene51; Gene52; Gene55; Gene56; Gene57; Gene60; Gene62; Gene63; Gene64; Gene65; Gene66; Gene68; Gene69; Gene72; Gene73; Gene76; Gene77; Gene79; Gene86; Gene87; Gene89; Gene90; Gene92; Gene94; Gene95; Gene96; Gene97; Gene100
High in Treatment,18,Gene2; Gene10; Gene16; Gene25; Gene32; Gene35; Gene37; Gene39; Gene40; Gene58; Gene67; Gene74; Gene81; Gene82; Gene83; Gene84; Gene93; Gene98
High in Control,18,Gene8; Gene9; Gene17; Gene27; Gene28; Gene34; Gene44; Gene53; Gene54; Gene59; Gene61; Gene70; Gene71; Gene75; Gene78; Gene85; Gene91; Gene99
Low Expression,2,Gene21; Gene80
High in Control & High in Treatment,2,Gene1; Gene88
